{
  "name": "GitRun",
  "version": "0.4.0",
  "git_commit": "0000000000000000000000000000000000000000",
  "repository": "Vider06/GitRun",
  "artifacts": [
    {
      "target": "x86_64-unknown-linux-gnu",
      "file": "GitRun-v0.4.0-x86_64-unknown-linux-gnu.tar.gz",
      "sha256": "0000000000000000000000000000000000000000000000000000000000000000"
    },
    {
      "target": "library-json-backup",
      "file": "library.zip",
      "sha256": "0000000000000000000000000000000000000000000000000000000000000000"
    }
  ]
}
